{
  "id":"hope_reborn_campaign","schemaVersion":1,"contentVersion":1,"version":1,"systemId":"cyberpunk-red","title":"Tales of the RED: Hope Reborn","sourceBook":"Cyberpunk RED - Hope Reborn [v1.1] CR3091.pdf","sourcePages":[5,6],"description":"Campaign-level state graph for Hope Reborn. It encodes the canonical six-mission sequence and campaign continuity while mission beat conversion remains independently versioned.","campaignType":"GUIDED_CAMPAIGN","recommendedCharacters":"New street-level Edgerunners; campaign assumes roughly 60 IP per session and supports combat and non-combat solutions.","startingRegion":"Night City","startingLocation":"hr_forlorn_hope","premise":"A street-level campaign centered on the Forlorn Hope and the difference a Crew can make for one community.","publicBackground":"The Forlorn Hope can become the Crew's home base and a community worth protecting.","gmBackground":"The six missions are interconnected and designed to occur in order, with later missions building on earlier outcomes; individual missions may branch and contain optional Beats.","openingSituation":"Establish the Crew's connection to the Forlorn Hope before the first mission begins.",
  "startDefinition":{"startingLocation":"hr_forlorn_hope","startingMap":null,"startingHex":null,"startingSceneId":"hr_scene_campaign_open","openingSituation":"Introduce the Forlorn Hope as a recurring home base and establish at least one personal connection when possible.","initialNpcIds":[],"initialEvents":[],"initialFlags":{"hr_campaign_started":true,"hr_current_mission":"angels_share"},"initialObjectives":["hr_obj_campaign"],"initialClocks":["hr_clock_community"],"initialConsequences":[],"openingConstraints":["PLAYER_AGENCY","MISSION_BRANCHES_PRESERVED","OPTIONAL_BEATS_NOT_FORCED","RULES_ENGINE_OWNS_CHECKS"]},
  "locations":[{"id":"hr_forlorn_hope","name":"The Forlorn Hope","type":"BAR_HOME_BASE","descriptionPublic":"A veteran-centered Night City bar that can become a second home for the Crew.","descriptionGM":"Recurring campaign hub; emotional connection to its staff/patrons strengthens campaign motivation.","arrivalDescription":"The Hope is a place to recover, hear rumors, meet patrons, and find the next thread.","exits":[],"npcIds":[],"encounterIds":[],"clueIds":[],"secretIds":[],"sourceReference":{"sourceBook":"Cyberpunk RED - Hope Reborn [v1.1] CR3091.pdf","pdfPage":6}}],
  "npcs":[],"factions":[],"creatures":[],"items":[],"clues":[],"secrets":[],
  "rumors":[{"id":"hr_rumor_framework","content":"Each mission has its own rumor table; rumors can be learned through a Media's Credibility or street gossip at GM discretion.","truth":"TRUE","sources":["MISSION_RUMOR_TABLES"],"locations":["hr_forlorn_hope"],"prerequisites":[],"reveals":[],"sourceReference":{"sourceBook":"Cyberpunk RED - Hope Reborn [v1.1] CR3091.pdf","pdfPage":6}}],
  "objectives":[{"id":"hr_obj_campaign","title":"Protect and strengthen the Hope's community","description":"Play through the interconnected campaign while preserving Crew agency and the consequences of each mission.","type":"PRIMARY","prerequisites":[],"successConditions":[{"type":"FLAG_EQUALS","key":"hr_mission_ripping_the_ripper_complete","value":true}],"failureConditions":[],"consequencesSuccess":[{"type":"SET_FLAG","target":"hr_campaign_complete","value":true}],"consequencesFailure":[],"unlocks":[],"rewards":[],"sourceReference":{"sourceBook":"Cyberpunk RED - Hope Reborn [v1.1] CR3091.pdf","pdfPage":6}}],"quests":[],
  "scenes":[{"id":"hr_scene_campaign_open","locationId":"hr_forlorn_hope","purpose":"Establish the campaign hub and Crew connection without forcing a personal backstory.","prerequisites":[],"participants":[],"knownFacts":["The Hope is a recurring campaign hub.","The campaign is designed as six interconnected missions."],"hiddenFacts":[],"availableClues":[],"availableEvents":["hr_event_begin_angels_share"],"availableEncounters":[],"possibleTriggers":["ON_FLAG"],"exits":[],"completionConditions":[],"sourceReference":{"sourceBook":"Cyberpunk RED - Hope Reborn [v1.1] CR3091.pdf","pdfPage":6}}],"encounters":[],
  "events":[
    {"id":"hr_event_begin_angels_share","trigger":{"type":"ON_FLAG","target":"hr_start_next_mission"},"prerequisites":[{"type":"FLAG_EQUALS","key":"hr_current_mission","value":"angels_share"}],"locationRestrictions":[],"timeRestrictions":[],"probability":1,"repeatPolicy":"ONCE","content":"Hand control to The Angel's Share mission module when its detailed beat graph is available.","ruleActions":[],"consequences":[{"type":"SET_FLAG","target":"hr_mission_angels_share_active","value":true}],"sourceReference":{"sourceBook":"Cyberpunk RED - Hope Reborn [v1.1] CR3091.pdf","pdfPage":6}},
    {"id":"hr_event_advance_real_estate","trigger":{"type":"ON_FLAG","target":"hr_mission_angels_share_complete"},"prerequisites":[],"locationRestrictions":[],"timeRestrictions":[],"probability":1,"repeatPolicy":"ONCE","content":"Advance campaign continuity to Real Estate Rumble.","ruleActions":[],"consequences":[{"type":"SET_FLAG","target":"hr_current_mission","value":"real_estate_rumble"}],"sourceReference":{"sourceBook":"Cyberpunk RED - Hope Reborn [v1.1] CR3091.pdf","pdfPage":6}},
    {"id":"hr_event_advance_neighborhood","trigger":{"type":"ON_FLAG","target":"hr_mission_real_estate_rumble_complete"},"prerequisites":[],"locationRestrictions":[],"timeRestrictions":[],"probability":1,"repeatPolicy":"ONCE","content":"Advance campaign continuity to Welcome to the Neighborhood.","ruleActions":[],"consequences":[{"type":"SET_FLAG","target":"hr_current_mission","value":"welcome_to_the_neighborhood"}],"sourceReference":{"sourceBook":"Cyberpunk RED - Hope Reborn [v1.1] CR3091.pdf","pdfPage":6}},
    {"id":"hr_event_advance_devils_cut","trigger":{"type":"ON_FLAG","target":"hr_mission_welcome_to_the_neighborhood_complete"},"prerequisites":[],"locationRestrictions":[],"timeRestrictions":[],"probability":1,"repeatPolicy":"ONCE","content":"Advance campaign continuity to The Devil's Cut.","ruleActions":[],"consequences":[{"type":"SET_FLAG","target":"hr_current_mission","value":"devils_cut"}],"sourceReference":{"sourceBook":"Cyberpunk RED - Hope Reborn [v1.1] CR3091.pdf","pdfPage":6}},
    {"id":"hr_event_advance_hopes_calling","trigger":{"type":"ON_FLAG","target":"hr_mission_devils_cut_complete"},"prerequisites":[],"locationRestrictions":[],"timeRestrictions":[],"probability":1,"repeatPolicy":"ONCE","content":"Advance campaign continuity to Hope's Calling!!!.","ruleActions":[],"consequences":[{"type":"SET_FLAG","target":"hr_current_mission","value":"hopes_calling"}],"sourceReference":{"sourceBook":"Cyberpunk RED - Hope Reborn [v1.1] CR3091.pdf","pdfPage":6}},
    {"id":"hr_event_advance_ripper","trigger":{"type":"ON_FLAG","target":"hr_mission_hopes_calling_complete"},"prerequisites":[],"locationRestrictions":[],"timeRestrictions":[],"probability":1,"repeatPolicy":"ONCE","content":"Advance campaign continuity to Ripping the Ripper.","ruleActions":[],"consequences":[{"type":"SET_FLAG","target":"hr_current_mission","value":"ripping_the_ripper"}],"sourceReference":{"sourceBook":"Cyberpunk RED - Hope Reborn [v1.1] CR3091.pdf","pdfPage":6}}
  ],"triggers":[],"conditions":[],"consequences":[],
  "clocks":[{"id":"hr_clock_community","name":"Hope community continuity","current":0,"max":6,"advanceTriggers":[],"regressTriggers":[],"thresholds":[1,2,3,4,5,6],"thresholdEvents":[],"visibleToPlayer":false,"sourceReference":{"sourceBook":"Cyberpunk RED - Hope Reborn [v1.1] CR3091.pdf","pdfPage":6}}],"timers":[],"stateFlags":[],"relationships":[],"transitions":[],"completionConditions":[{"type":"FLAG_EQUALS","key":"hr_campaign_complete","value":true}],"failureConditions":[],"rewards":[],"randomTables":[],
  "gmGuidance":["Run missions in campaign order by default because later missions build on earlier events.","Never force optional Beats or a branch the Crew did not choose.","Use each mission's flowchart/beat graph as structure, not as a railroad.","Rumors and Infobox knowledge remain gated by their mission rules and appropriate checks when the GM chooses to require them.","The fourth mission emphasizes cunning, social skills, and stealth; do not convert every obstacle into combat."],
  "sourceReferences":[{"sourceBook":"Cyberpunk RED - Hope Reborn [v1.1] CR3091.pdf","chapter":"Playing the Campaign","section":"Welcome to The Hope / Mission Layout","pdfPage":6}]
}