{"id":"hope_reborn_hopes_calling","schemaVersion":1,"contentVersion":1,"version":1,"systemId":"cyberpunk-red","title":"Hope Reborn — Hope's Calling!!!","sourceBook":"Cyberpunk RED - Hope Reborn [v1.1] CR3091.pdf","sourcePages":[113,115,116,117,120,121,122,123,124,125,126,127,128,129,130,131,132,133,134,135,136],"campaignType":"GUIDED_CAMPAIGN","startingRegion":"Woodland Park, Night City","startingLocation":"hc_forlorn_hope","premise":"Prepare the rebuilt Forlorn Hope for opening night while uncovering sabotage and surviving the Red Chrome Legion assault.","gmBackground":"Vox and Populi infiltrated the rebuild under the identities Anne and Arthur Cartwright. The engine must keep their identities sealed until discovered and must not auto-complete preparation tasks.","startDefinition":{"startingLocation":"hc_forlorn_hope","startingSceneId":"hc_task_hub","initialNpcIds":["hc_marianne","hc_backhand"],"initialFlags":{"hc_started":true},"initialObjectives":["hc_obj_opening"],"initialClocks":["hc_clock_opening"],"openingConstraints":["PLAYER_AGENCY","RULES_ENGINE_OWNS_CHECKS","GM_SECRETS_SEALED","UNFINISHED_TASKS_PERSIST"]},"locations":[{"id":"hc_forlorn_hope","name":"The rebuilt Forlorn Hope","type":"BAR","sourceReference":{"sourceBook":"Hope Reborn","printedPage":120}},{"id":"hc_stems_seeds","name":"Stems & Seeds","type":"SUPPLIER","sourceReference":{"sourceBook":"Hope Reborn","printedPage":122}},{"id":"hc_highcourt","name":"Highcourt Plaza","type":"HOTEL","sourceReference":{"sourceBook":"Hope Reborn","printedPage":127}}],"npcs":[{"id":"hc_marianne","name":"Marianne Freeman","role":"OWNER","sourceReference":{"sourceBook":"Hope Reborn","printedPage":117}},{"id":"hc_backhand","name":"Backhand","role":"TECH","sourceReference":{"sourceBook":"Hope Reborn","printedPage":125}},{"id":"hc_random","name":"Random","role":"MUSICIAN","sourceReference":{"sourceBook":"Hope Reborn","printedPage":128}},{"id":"hc_gentleman","name":"The Gentleman","role":"CREDITOR","sourceReference":{"sourceBook":"Hope Reborn","printedPage":128}},{"id":"hc_vox","name":"Vox / Anne Cartwright","role":"INFILTRATOR","sourceReference":{"sourceBook":"Hope Reborn","printedPage":121}},{"id":"hc_populi","name":"Populi / Arthur Cartwright","role":"INFILTRATOR","sourceReference":{"sourceBook":"Hope Reborn","printedPage":121}}],"factions":[{"id":"hc_rcl","name":"Red Chrome Legion","sourceReference":{"sourceBook":"Hope Reborn","printedPage":116}}],"creatures":[],"items":[{"id":"hc_signal_tracker","name":"Backhand's signal tracker","sourceReference":{"sourceBook":"Hope Reborn","printedPage":125}}],"clues":[{"id":"hc_clue_cartons","title":"Reserved cartons","locationIds":["hc_stems_seeds"],"npcIds":[],"discoveryMethods":["PERCEPTION"],"prerequisites":[],"information":"A departing blue pickup carries cartons reserved for M. Freeman.","unlocks":["hc_supply_theft"],"repeatable":false,"required":false,"sourceReference":{"sourceBook":"Hope Reborn","printedPage":123}},{"id":"hc_clue_signal","title":"Sabotage signal","locationIds":["hc_forlorn_hope"],"npcIds":["hc_backhand"],"discoveryMethods":["ELECTRONICS_SECURITY","PERCEPTION","TACTICS"],"prerequisites":[],"information":"A hidden device is tied into the Hope's electrical/security systems.","unlocks":["hc_sabotage_known"],"repeatable":false,"required":false,"sourceReference":{"sourceBook":"Hope Reborn","printedPage":125}},{"id":"hc_clue_annie","title":"Anne inconsistencies","locationIds":["hc_forlorn_hope"],"npcIds":["hc_vox"],"discoveryMethods":["HUMAN_PERCEPTION","DEDUCTION","CYBERDECK"],"prerequisites":[],"information":"Evidence links Anne to the sabotage and a possible Virus in the Hope's NET Architecture.","unlocks":["hc_vox_exposed"],"repeatable":false,"required":false,"sourceReference":{"sourceBook":"Hope Reborn","printedPage":131}}],"secrets":[{"id":"hc_secret_infiltrators","information":"Anne and Arthur Cartwright are Vox and Populi of the Red Chrome Legion, positioned for an opening-night attack.","prerequisites":[],"revealConditions":[{"type":"CLUE_DISCOVERED","clueId":"hc_clue_annie"}],"relatedNpcIds":["hc_vox","hc_populi"],"relatedLocationIds":["hc_forlorn_hope"],"sourceReference":{"sourceBook":"Hope Reborn","printedPage":116}}],"rumors":[],"objectives":[{"id":"hc_obj_opening","title":"Get The Hope through opening night","description":"Prepare what the Crew can, investigate sabotage, preserve unfinished-task consequences, and defend the Hope when the attack comes.","type":"PRIMARY","prerequisites":[],"successConditions":[{"type":"FLAG","key":"hc_resolution_reached"}],"failureConditions":[],"consequencesSuccess":[{"type":"SET_FLAG","target":"hr_mission_hopes_calling_complete","value":true}],"consequencesFailure":[],"unlocks":["hope_reborn_ripping_the_ripper"],"rewards":[],"sourceReference":{"sourceBook":"Hope Reborn","printedPage":136}}],"quests":[],"scenes":[{"id":"hc_task_hub","locationId":"hc_forlorn_hope","purpose":"Open preparation hub. Crew chooses task order; time spent and tasks left undone persist into opening night.","prerequisites":[],"participants":["hc_marianne","hc_backhand"],"knownFacts":[],"hiddenFacts":["hc_secret_infiltrators"],"availableClues":["hc_clue_signal","hc_clue_annie"],"availableEvents":[],"availableEncounters":[],"possibleTriggers":[],"exits":["hc_supplies","hc_gentleman","hc_sabotage","hc_opening"],"completionConditions":[],"sourceReference":{"sourceBook":"Hope Reborn","printedPage":122}},{"id":"hc_supplies","locationId":"hc_stems_seeds","purpose":"Recover opening-night ingredients; preserve investigation and player choice about the thieves.","prerequisites":[],"participants":[],"knownFacts":[],"hiddenFacts":[],"availableClues":["hc_clue_cartons"],"availableEvents":[],"availableEncounters":[],"possibleTriggers":[],"exits":["hc_task_hub"],"completionConditions":[],"sourceReference":{"sourceBook":"Hope Reborn","printedPage":123}},{"id":"hc_gentleman","locationId":"hc_highcourt","purpose":"Resolve Random's debt by negotiation, payment, creativity, or player-chosen violence; do not force a route.","prerequisites":[],"participants":["hc_random","hc_gentleman"],"knownFacts":[],"hiddenFacts":[],"availableClues":[],"availableEvents":[],"availableEncounters":["hc_enc_gentleman"],"possibleTriggers":[],"exits":["hc_task_hub"],"completionConditions":[],"sourceReference":{"sourceBook":"Hope Reborn","printedPage":128}},{"id":"hc_sabotage","locationId":"hc_forlorn_hope","purpose":"Track electrical anomalies, identify infiltrators and optionally warn Marianne/clean the NET Virus.","prerequisites":[],"participants":["hc_backhand","hc_vox","hc_populi"],"knownFacts":[],"hiddenFacts":["hc_secret_infiltrators"],"availableClues":["hc_clue_signal","hc_clue_annie"],"availableEvents":[],"availableEncounters":[],"possibleTriggers":[],"exits":["hc_task_hub","hc_opening"],"completionConditions":[],"sourceReference":{"sourceBook":"Hope Reborn","printedPage":125}},{"id":"hc_opening","locationId":"hc_forlorn_hope","purpose":"Opening Night. Apply consequences of completed/unfinished preparation and run the RCL assault without erasing earlier choices.","prerequisites":[],"participants":["hc_marianne","hc_backhand","hc_vox","hc_populi"],"knownFacts":[],"hiddenFacts":[],"availableClues":[],"availableEvents":["hc_event_resolution"],"availableEncounters":["hc_enc_opening"],"possibleTriggers":[],"exits":[],"completionConditions":[],"sourceReference":{"sourceBook":"Hope Reborn","printedPage":133}}],"encounters":[{"id":"hc_enc_gentleman","participants":["hc_gentleman"],"locationId":"hc_highcourt","trigger":"PLAYER_CHOICE","victoryConditions":[],"retreatConditions":[],"consequencesVictory":[],"consequencesDefeat":[],"ruleActions":[{"type":"SOCIAL_OR_COMBAT_RESOLUTION","authority":"RULES_ENGINE","playerChoice":true}],"sourceReference":{"sourceBook":"Hope Reborn","printedPage":128}},{"id":"hc_enc_opening","participants":["hc_vox","hc_populi"],"locationId":"hc_forlorn_hope","trigger":"OPENING_NIGHT","victoryConditions":[],"retreatConditions":[],"consequencesVictory":[],"consequencesDefeat":[],"ruleActions":[{"type":"COMBAT_SEQUENCE","authority":"RULES_ENGINE"},{"type":"BAR_BRAWL_OPPOSED_CHECK","authority":"RULES_ENGINE","eachRound":true},{"type":"TIMED_CHAOS_SEQUENCE","authority":"RULES_ENGINE","preserveUnfinishedTasks":true}],"sourceReference":{"sourceBook":"Hope Reborn","printedPage":135}}],"events":[{"id":"hc_event_resolution","trigger":{"type":"ON_FLAG","target":"hc_opening_resolved"},"prerequisites":[{"type":"FLAG","key":"hc_opening_resolved"}],"locationRestrictions":["hc_forlorn_hope"],"probability":1,"repeatPolicy":"ONCE","content":"Opening-night outcome becomes persistent campaign history; unfinished preparations remain consequential.","ruleActions":[],"consequences":[{"type":"SET_FLAG","target":"hc_resolution_reached","value":true},{"type":"SET_FLAG","target":"hr_mission_hopes_calling_complete","value":true}],"sourceReference":{"sourceBook":"Hope Reborn","printedPage":136}}],"triggers":[],"conditions":[],"consequences":[],"clocks":[{"id":"hc_clock_opening","name":"Time until opening night","current":0,"max":12,"advanceTriggers":[],"regressTriggers":[],"thresholds":[12],"thresholdEvents":[],"visibleToPlayer":true,"sourceReference":{"sourceBook":"Hope Reborn","printedPage":122}}],"timers":[],"stateFlags":[],"relationships":[],"transitions":[],"completionConditions":[{"type":"FLAG","key":"hc_resolution_reached"}],"failureConditions":[],"rewards":[],"randomTables":[],"gmGuidance":["Task order belongs to the Crew.","Do not reveal Vox/Populi identities before evidence supports it.","Rules Engine resolves all checks and combat.","Tasks left undone alter opening-night fiction and mechanics; never silently repair them."],"sourceReferences":[{"sourceBook":"Cyberpunk RED - Hope Reborn [v1.1] CR3091.pdf","section":"Hope's Calling!!!","printedPage":113}]}